{
  "$schema": "../../../schemas/skill.v1.schema.json",
  "schemaVersion": "1",
  "id": "bnbchain-skills",
  "name": "bnbchain skills",
  "github_url": "https://github.com/bnb-chain/bnbchain-skills",
  "category": [
    "infrastructure",
    "blockchain"
  ],
  "description": "A skill for building on BNBChain - covers EVM interactions, smart contracts, tokens, NFTs, wallet operations, ERC-8004 agent tools, and Greenfield storage. Use it when developing or querying BNB Smart Chain and opBNB infrastructure via the BNB Chain MCP.",
  "publisher": {
    "username": "bnb-chain",
    "display_name": "bnb-chain",
    "type": "Organization",
    "profile_url": "https://github.com/bnb-chain",
    "avatar_url": "https://avatars.githubusercontent.com/u/45615063?v=4"
  },
  "source": {
    "commit": "4f6557b7f776c2ac6748027baadf18d44db67da7",
    "fetched_at": "2026-03-11T16:26:58.437Z"
  },
  "repo": {
    "stars": 54,
    "default_branch": "main"
  },
  "security": {
    "agentguard_scan_id": "60f77a64-d05c-49c0-8ab6-29ba52e029a2",
    "agentguard_report_url": "https://agentguard.gopluslabs.io/report/60f77a64-d05c-49c0-8ab6-29ba52e029a2",
    "agentguard_result": {
      "risk_score": 0,
      "risk_level": "safe",
      "verdict": "passed",
      "summary": "No threats detected. Skill appears safe.",
      "threats": []
    }
  },
  "published_at": "2026-03-11T16:26:58.437Z"
}
