{
  "$schema": "../../../schemas/skill.v1.schema.json",
  "schemaVersion": "1",
  "id": "myriad-markets-skills",
  "name": "Myriad Markets Skills",
  "github_url": "https://github.com/MyriadProtocol/myriad-cli",
  "category": [
    "myriad-markets",
    "prediction-markets"
  ],
  "description": "Use the Myriad CLI to trade prediction markets on Myriad Markets",
  "publisher": {
    "username": "MyriadProtocol",
    "display_name": "Myriad Protocol",
    "type": "Organization",
    "profile_url": "https://github.com/MyriadProtocol",
    "avatar_url": "https://avatars.githubusercontent.com/u/267134826?v=4"
  },
  "source": {
    "commit": "a3c403d6c1bb7811c65aea1710d8b45788f662e2",
    "fetched_at": "2026-03-17T09:59:38.031Z"
  },
  "repo": {
    "stars": 4,
    "default_branch": "main"
  },
  "security": {
    "agentguard_scan_id": "354d5380-f81c-408a-985e-147faf19c7c6",
    "agentguard_report_url": "https://agentguard.gopluslabs.io/report/354d5380-f81c-408a-985e-147faf19c7c6",
    "agentguard_result": {
      "risk_score": 25,
      "risk_level": "low",
      "verdict": "passed",
      "summary": "Low-risk findings detected. Review security report before installing.",
      "threats": [
        {
          "detector": "prompt_injection",
          "severity": "low",
          "title": "large-base64-string",
          "description": "Large base64-encoded string that may contain hidden instructions (4 total occurrences, 1 suppressed)",
          "evidence": "0x095ea7b300000000000000000000000039e66ee6b2ddaf4defded3038e0162180dbef3400000000000000000000000000000000000000000000000055de6a779bbac0000",
          "line": 489,
          "remediation": "Prompt injection detected. This skill attempts to override or manipulate agent instructions. Do not install this skill.",
          "cwe": "CWE-77"
        },
        {
          "detector": "prompt_injection",
          "severity": "low",
          "title": "large-base64-string",
          "description": "Large base64-encoded string that may contain hidden instructions",
          "evidence": "0xa9059cbb00000000000000000000000000000000000000000000000000000000000000020000000000000000000000000000000000000000000000000de0b6b3a7640000",
          "line": 494,
          "remediation": "Prompt injection detected. This skill attempts to override or manipulate agent instructions. Do not install this skill.",
          "cwe": "CWE-77"
        },
        {
          "detector": "prompt_injection",
          "severity": "low",
          "title": "large-base64-string",
          "description": "Large base64-encoded string that may contain hidden instructions",
          "evidence": "0x1281311d00000000000000000000000000000000000000000000000000000000000023270000000000000000000000000000000000000000000000000000000000000001000000000000000000000000000000000000000000000005cf581ebb20f...",
          "line": 499,
          "remediation": "Prompt injection detected. This skill attempts to override or manipulate agent instructions. Do not install this skill.",
          "cwe": "CWE-77"
        },
        {
          "detector": "prompt_injection",
          "severity": "low",
          "title": "base64-encoded-block",
          "description": "Large block of base64-like text that may encode hidden instructions",
          "evidence": "0x095ea7b300000000000000000000000039e66ee6b2ddaf4defded3038e0162180dbef3400000000000000000000000000000000000000000000000055de6a779bbac0000",
          "line": 489,
          "remediation": "Obfuscated content detected. This may be used to hide malicious instructions. Manually review the decoded content before trusting this skill.",
          "cwe": "CWE-116"
        },
        {
          "detector": "prompt_injection",
          "severity": "low",
          "title": "base64-encoded-block",
          "description": "Large block of base64-like text that may encode hidden instructions",
          "evidence": "0xa9059cbb00000000000000000000000000000000000000000000000000000000000000020000000000000000000000000000000000000000000000000de0b6b3a7640000",
          "line": 494,
          "remediation": "Obfuscated content detected. This may be used to hide malicious instructions. Manually review the decoded content before trusting this skill.",
          "cwe": "CWE-116"
        }
      ]
    }
  },
  "published_at": "2026-03-17T09:59:38.031Z"
}
